제목,링크
sub) 전국 고양이 집사들은 이 12살 소년을 본받아야 합니다ㅣ미야옹철의 가정방문 오레오래치즈 편,https://www.youtube.com/watch?v=as6QgH7b_-I&list=PLhLLGKcG94RPqLZlSuRYGRCebT74A-L49&index=1&pp=iAQB
고양이에게 무시 당하고 있다면ㅣ미야옹철의 가정방문 빵먹다살찐떡 편,https://www.youtube.com/watch?v=c4oHWbd6LQw&list=PLhLLGKcG94RPqLZlSuRYGRCebT74A-L49&index=2&pp=iAQB
sub) 임보냥이 오면 첫째냥은 무조건 스트레스 받을까?ㅣ미야옹철의 가정방문 쫀떡이 편,https://www.youtube.com/watch?v=z886hW6vNnw&list=PLhLLGKcG94RPqLZlSuRYGRCebT74A-L49&index=3&pp=iAQB
(감동주의) 서로에게 구원이 되어준 냥줍 이야기ㅣ미야옹철의 가정방문 뚜리뚜바랑 편,https://www.youtube.com/watch?v=lStn8zvbJfY&list=PLhLLGKcG94RPqLZlSuRYGRCebT74A-L49&index=4&pp=iAQB
"[EN] 저는 고양이를 위해 ""이걸"" 매일할 수 있어요ㅣ미야옹철의 가정방문 스텔라장 편",https://www.youtube.com/watch?v=XgTbOIR4UJA&list=PLhLLGKcG94RPqLZlSuRYGRCebT74A-L49&index=5&pp=iAQB
무지개다리 건넌 고양이에게 전하고 싶은 말ㅣ펀치넬로 편,https://www.youtube.com/watch?v=5cZWaO9Uetg&list=PLhLLGKcG94RPqLZlSuRYGRCebT74A-L49&index=6&pp=iAQB
